<?xml version="1.0" encoding="UTF-8" ?>
<holidays xmlns="https://heigl.org/holidays"
					xmlns:xsi="http://www.w3.org/2001/XMLSchema-instance"
					xsi:schemaLocation="holidays.xsd https://heigl.org/xml/xsd/holidays.xsd"
					xmlns:xi="http://www.w3.org/2001/XInclude"
>
	<resources>
		<resource href="https://en.wikipedia.org/wiki/Public_holidays_in_Switzerland" lastChecked="2023-04-21">Wikipedia</resource>
	</resources>
	<date day="1" month="1" free="true">Neujahrstag</date>
	<date day="2" month="1" free="true" restriction="despite not being an official holiday mostly free">Berchtoldstag</date>
	<date day="19" month="3" free="true" restriction="only in some municipalities">Josefstag</date>
	<easter offset="-2" free="true">Karfreitag</easter>
	<easter offset="1" free="true" restriction="despite not being an official holiday mostly free">Ostermontag</easter>
	<date day="1" month="5" free="true" restriction="starts at 12:00; only for public employees; usually observed by everyone">Tag der Arbeit</date>
	<easter offset="39" free="true">Auffahrt</easter>
	<easter offset="50" free="true" restriction="despite not being an official holiday mostly free">Pfingstmontag</easter>
	<easter offset="60" free="true" restriction="only in some municipalities">Frohnleichnam</easter>
	<date day="1" month="8" free="true">Bundesfeier</date>
	<date day="15" month="8" free="true" restriction="only in some municipalities">Mariä Himmelfahrt</date>
	<date day="1" month="11" free="true" restriction="only in some municipalities">Allerheiligen</date>
	<date day="8" month="12" free="true" restriction="only in some municipalities">Mariä Empfängnis</date>
	<date day="25" month="12" free="true">Weihnachtstag</date>
	<date day="26" month="12" free="true">Stephanstag</date>
</holidays>
